{"roadmap_id": "example-ops", "revision": 1, "incomplete": false, "first_automation": "follow-up", "first_automation_reason": null, "cards": [{"id": "follow-up", "version": 1, "approval": {"required": true, "approver": "Owner", "gate": "Approve send"}, "group": "Now", "action": "Create CRM follow-up", "hours_per_month": 6, "hourly_value": 100, "annual_labor_value": 7200, "causal_path": {"trigger": "new lead", "collection": "CRM query", "judgment": "classify", "action": "create follow-up", "destination": "CRM", "read_back": "CRM lookup", "failure_visibility": "ops inbox"}, "evidence": [{"label": "observed", "claim": "follow-ups are missed", "source": "redacted CRM sample"}], "existing_coverage": {"definitions": [], "recent_runs": [], "outputs": [], "failure_visibility": []}, "gaps": ["No deterministic follow-up"], "intervention": "agent automation", "diagnosis": "manual follow-up is inconsistent", "proof": "observed CRM sample", "verdict": "automate with an agent"}], "business": "Example Works", "date": "2026-09-01", "stopping_point": null, "consent": [{"category": "documents", "scope": "CRM export"}], "exclusions": [], "first_move": "follow-up", "pending_feedback": [], "owner_approval": {"roadmap_id": "example-ops", "roadmap_revision": 1, "approved_by": "Owner", "approved_at": "2026-09-01T00:00:00Z"}}